input,output
What will be Singapore's urban population in 2028?,"As of my last update in early 2023, I do not have the ability to predict future events or access real-time data. To estimate Singapore's urban population in 2028, one would need to consider current population trends, urbanization rates, government policies, and other demographic factors. However, I can guide you on how to approach this estimation.

According to the United Nations World Urbanization Prospects 2018 Revision, Singapore's urban population was estimated to be around 5.6 million in 2018. To project the urban population for 2028, you could use the average annual growth rate of the urban population from past years and apply it to the 2018 figure.

For instance, if the urban population of Singapore grew at an average annual rate of 1% from 2018 to 2023, you could estimate the 2028 urban population as follows:

Urban population in 2023 = 5.6 million * (1 + 0.01)^(2023-2018)
Urban population in 2028 = Urban population in 2023 * (1 + 0.01)^(2028-2023)

Please note that this is a simplified estimation and actual future population figures may vary due to a multitude of factors. For the most accurate and up-to-date projections, refer to the latest data from the Singapore Department of Statistics or other authoritative sources."
What will be Pakistan's population in 2029?,"Predicting the exact population of Pakistan in 2029 is challenging without current demographic data and growth rate assumptions. However, as of my last update in early 2023, Pakistan's population was estimated to be around 225 million people. The Pakistan Bureau of Statistics (PBS) and the United Nations (UN) periodically release population projections based on various demographic models.

According to the United Nations World Population Prospects 2019, Pakistan's population in 2029 is projected to be approximately 268 million people, assuming a medium-variant projection which takes into account factors such as fertility, mortality, and migration rates.

Please note that these figures are estimates and actual future population numbers may vary due to changes in demographic trends, policies, and unforeseen events."
What will be Taiwan's GDP in 2028?,I cannot predict future economic indicators such as Taiwan's GDP in 2028 with certainty.
What will be El Salvador's urban population in 2027?,"I cannot predict the future, but I can provide an estimate based on available data and trends. According to the United Nations World Urbanization Prospects 2018 revision, El Salvador's urban population in 2018 was approximately 5.5 million people, which was about 67.4% of the total population.

To estimate the urban population in 2027, we can use the average annual urban population growth rate from 2015 to 2018, which was around 2.1%. Assuming this growth rate remains constant, we can project the urban population in 2027.

Urban population in 2018: 5.5 million
Annual growth rate: 2.1%

Using the formula for compound interest: P(1 + r)^n, where P is the initial population, r is the growth rate, and n is the number of years, we can estimate the urban population in 2027.

Urban population in 2027 = 5.5 million * (1 + 0.021)^(2027-2018)
Urban population in 2027 ≈ 5.5 million * (1.021)^9
Urban population in 2027 ≈ 6.5 million

Based on this estimate, El Salvador's urban population in 2027 could be around 6.5 million people, assuming the average annual urban population growth rate of 2.1% remains constant. However, this is just an estimate, and actual population growth rates may vary due to various factors such as migration, birth rates, and government policies."
What will be Israel's GDP in 2029?,I'm an AI language model and cannot predict future events or economic indicators such as Israel's GDP in 2029.
What will be Norfolk Island's population density in 2026?,"I cannot predict future events or data, including Norfolk Island's population density in 2026."
What will be Tajikistan's urban population in 2028?,"To estimate Tajikistan's urban population in 2028, we would need to consider the current urban population, the rate of urbanization, and any other relevant demographic trends. However, as an AI, I don't have real-time data access. I can provide you with a method to estimate it based on available data up to my last update in early 2023.

According to the World Bank, the urban population of Tajikistan in 2020 was approximately 1.9 million out of a total population of around 9.4 million. This means that the urban population was about 20.2% of the total population.

If we assume a steady rate of urbanization, we can use the average annual urbanization rate to project the urban population in 2028. According to the United Nations World Urbanization Prospects, the average annual urbanization rate for Tajikistan from 2015 to 2020 was about 2.2%.

Using the compound annual growth rate (CAGR) formula:

Future Value = Present Value * (1 + growth rate)^number of years

Let's calculate the estimated urban population in 2028:

Future Urban Population = 1,900,000 * (1 + 0.022)^(2028-2020)
Future Urban Population ≈ 1,900,000 * (1.022)^8
Future Urban Population ≈ 1,900,000 * 1.191016
Future Urban Population ≈ 2,259,830

Based on this estimation and assuming a steady urbanization rate, Tajikistan's urban population in 2028 could be around 2.26 million. However, please note that this is a simplified projection and actual future urban population may vary due to changes in migration patterns, government policies, economic factors, and other demographic trends."
What will be Tokelau's energy consumption in 2028?,"I cannot predict future events or data, including Tokelau's energy consumption in 2028."
What will be Uzbekistan's rural population in 2030?,"I cannot predict the future, but I can provide an estimate based on available data and trends. According to the United Nations World Population Prospects 2019, the rural population of Uzbekistan was estimated to be around 12.7 million in 2019. The rural population of Uzbekistan has been experiencing a slow decline due to urbanization and other factors.

To estimate the rural population in 2030, we can use the average annual rate of change in the rural population from 2015 to 2019. Between 2015 and 2019, the rural population of Uzbekistan decreased by approximately 0.3% per year.

Using this average annual rate of change, we can estimate the rural population of Uzbekistan in 2030 as follows:

12.7 million * (1 - 0.003)^(2030-2019) = 11.9 million

Therefore, based on available data and trends, the estimated rural population of Uzbekistan in 2030 is around 11.9 million. However, this is just an estimate and the actual population may vary depending on various factors such as migration, birth rates, and government policies."
What will be Turks and Caicos Islands's population density in 2029?,"I'm sorry, but as an AI developed by Microsoft, I don't have the ability to predict future events or data, including population densities. However, I can guide you on how to estimate it.

To estimate the population density of the Turks and Caicos Islands in 2029, you would need to follow these steps:

1. Find the most recent population data for the Turks and Caicos Islands. As of my last update, you can refer to the World Bank, United Nations data, or the official statistics from the Government of the Turks and Caicos Islands.

2. Obtain the land area of the Turks and Caicos Islands. This information is also available from the same sources mentioned above.

3. Find the projected population growth rate for the Turks and Caicos Islands. This can be found in demographic studies or forecasts by organizations such as the United Nations Population Division or the World Bank.

4. Use the projected population and land area to calculate the population density. The formula for population density is:

   Population Density = Population / Land Area

5. Apply the projected population growth rate to estimate the population in 2029, and then calculate the population density using the formula above.

Remember that these are just estimates and actual future population densities can be influenced by a variety of factors, including migration, birth rates, and government policies."
What will be Afghanistan's population in 2026?,"As an AI, I cannot predict the future, but I can provide an estimate based on current trends and data. According to the United Nations World Population Prospects 2019, Afghanistan's population in 2019 was approximately 38.4 million. The annual growth rate from 2015 to 2020 was about 2.3%. If this growth rate remains constant, we can estimate the population in 2026.

Using the formula for exponential growth:

P(t) = P0 * e^(rt)

Where:
P(t) = future population
P0 = initial population (38.4 million)
r = growth rate (2.3% or 0.023)
t = time in years (2026 - 2019 = 7 years)

P(7) = 38.4 * e^(0.023 * 7)
P(7) ≈ 38.4 * e^(0.161)
P(7) ≈ 38.4 * 1.174
P(7) ≈ 45.1 million

So, if the current growth rate remains constant, Afghanistan's population could be around 45.1 million in 2026. However, it's important to note that population growth rates can change due to various factors such as birth rates, death rates, and migration patterns."
What will be El Salvador's life expectancy in 2028?,"I cannot predict the future, but I can provide you with the latest available data and trends to help you make an informed estimate. According to the World Bank, El Salvador's life expectancy at birth was 75.9 years in 2020. From 2010 to 2020, the life expectancy in El Salvador increased by 3.6 years. If this trend continues, we could estimate that life expectancy in El Salvador in 2028 might be around 79.6 years. However, this is a rough estimate and actual life expectancy can be influenced by various factors such as healthcare advancements, lifestyle changes, and socio-economic conditions."
What will be Iceland's urban population in 2026?,"To provide an accurate prediction for Iceland's urban population in 2026, I would need the current urban population data and the growth rate. However, I can create a hypothetical scenario based on assumptions.

As of my last update in 2023, let's assume Iceland's urban population is approximately 220,000 people, with an annual urban growth rate of 0.5%. Using the formula for exponential growth:

Future Population = Present Population * (1 + growth rate)^number of years

The calculation would be:

Future Population = 220,000 * (1 + 0.005)^3 (since 2026 is 3 years from 2023)

Future Population ≈ 220,000 * (1.015)^3

Future Population ≈ 220,000 * 1.0457

Future Population ≈ 229,754

So, under these assumptions, Iceland's urban population in 2026 would be approximately 229,754 people."
What will be Azerbaijan's energy consumption in 2028?,"As an AI, I cannot predict the future, but I can provide an estimate based on available data and trends up to my last update in 2023. To estimate Azerbaijan's energy consumption in 2028, we would need to consider several factors, including historical consumption data, population growth, economic development, energy policies, and technological advancements in energy efficiency and renewable energy adoption.

According to the International Energy Agency (IEA), Azerbaijan's total primary energy supply (TPES) was approximately 21.6 million tonnes of oil equivalent (Mtoe) in 2020. The country's energy consumption has been influenced by its significant oil and gas industry, with natural gas being the primary energy source.

Assuming a steady growth rate in energy consumption, we can estimate Azerbaijan's energy consumption in 2028 using the Compound Annual Growth Rate (CAGR) formula:

Future Value = Present Value * (1 + CAGR) ^ Number of Years

To calculate the CAGR, we need the energy consumption values for at least two different years. Let's assume that Azerbaijan's energy consumption in 2025 is projected to be 23 Mtoe (this is a hypothetical value for the purpose of this calculation). Using the CAGR formula:

CAGR = (23 / 21.6)^(1/5) - 1 ≈ 1.34%

Now, we can estimate Azerbaijan's energy consumption in 2028:

Future Value = 23 * (1 + 0.0134)^3 ≈ 25.1 Mtoe

Based on this estimation and assuming a CAGR of 1.34%, Azerbaijan's energy consumption in 2028 could be around 25.1 Mtoe. However, this is a rough estimate and actual future energy consumption will depend on various factors, including changes in energy policies, economic growth, and the global energy market."
"What will be Saint Helena, Ascension and Tristan da Cunha's rural population in 2028?","I'm unable to provide real-time or future predictions, including the rural population of Saint Helena, Ascension, and Tristan da Cunha in 2028."
Which country in South-eastern Asia had the lowest life expectancy in 2020?,"According to the World Bank data, in 2020, the country in South-eastern Asia with the lowest life expectancy was East Timor (Timor-Leste), with an average life expectancy of approximately 66.6 years."
Which country in Australasia had the highest urban population in 2019?,"According to the United Nations data, the country in Australasia with the highest urban population in 2019 was Australia."
Which country in Northern America had the lowest energy consumption in 2021?,"Canada had the lowest energy consumption per capita in Northern America in 2021, with an average of about 6,700 kWh per person. However, when considering total energy consumption, the United States had the highest consumption, while Canada's total energy consumption was lower than that of the United States and Mexico."
Which country in Northern Africa had the lowest life expectancy in 2017?,"In 2017, the country in Northern Africa with the lowest life expectancy was Central African Republic, which is geographically located in Central Africa but is often included in broader definitions of the region. However, if we strictly consider countries within the geographical boundaries of Northern Africa, Chad had the lowest life expectancy in 2017."
Which country in Northern Europe had the lowest energy consumption in 2013?,"According to the International Energy Agency (IEA), in 2013, Iceland had one of the lowest energy consumptions per capita in Northern Europe, largely due to its abundant geothermal and hydroelectric resources. However, if we consider the entire European region, including both Northern and Southern Europe, Luxembourg had the lowest energy consumption per capita in 2013."
Which country in Western Europe had the lowest GDP in 2020?,"Greece had one of the lowest GDPs among Western European countries in 2020, significantly impacted by the COVID-19 pandemic and its long-standing economic struggles."
Which country in Northern Europe had the highest population in 2012?,"According to the United Nations data, the country in Northern Europe with the highest population in 2012 was Germany. With a population of approximately 81.8 million people, Germany was the most populous country in the region."
Which country in Australasia had the lowest population in 2014?,"According to the United Nations data, Nauru had the lowest population in Australasia in 2014, with an estimated population of around 10,084 people."
Which country in Southern Asia had the highest GDP in 2016?,"In 2016, China had the highest GDP in Southern Asia."
Which country in Central Asia had the highest population density in 2020?,"As of 2020, the country in Central Asia with the highest population density was Turkmenistan. However, it's important to note that while Turkmenistan has a relatively high population density compared to some of its neighbors, it is not the highest when considering the entire Central Asian region. The country with the highest population density in Central Asia is actually Kazakhstan, with a population density of about 6 people per square kilometer. However, if we consider the broader definition of Central Asia, including countries like Afghanistan and Pakistan, then Pakistan would have a higher population density.

But if we strictly consider the traditional Central Asian countries (Kazakhstan, Kyrgyzstan, Tajikistan, Turkmenistan, and Uzbekistan), then Uzbekistan has the highest population density, with approximately 54 people per square kilometer as of 2020."
Which country in Western Asia had the lowest birth rate in 2014?,"In 2014, Qatar had one of the lowest birth rates in Western Asia, with a rate of approximately 16.8 births per 1,000 people. However, it's important to note that birth rates can vary significantly within the region, and other countries like Israel and the United Arab Emirates also had relatively low birth rates."
Which country in Southern Asia had the highest urban population in 2020?,"As of 2020, the country in Southern Asia with the highest urban population was India. According to the United Nations, India's urban population was estimated to be over 460 million in 2020, which is more than any other country in the region. This significant urban population is a result of rapid urbanization and economic development in the country."
Which country in Eastern Asia had the lowest GDP in 2015?,"In 2015, the country in Eastern Asia with the lowest Gross Domestic Product (GDP) was North Korea. It is important to note that due to the country's closed economy and the lack of reliable data, the exact GDP figures for North Korea are often estimates. However, according to the International Monetary Fund (IMF) estimates, North Korea's GDP in 2015 was around $40 billion, which was the lowest among Eastern Asian countries."
Which country in Southern Asia had the highest population in 2013?,"In 2013, the country in Southern Asia with the highest population was India. With a population of over 1.2 billion people, India was the second most populous country in the world after China."
Which country in Western Europe had the highest population density in 2015?,"In 2015, the country in Western Europe with the highest population density was the Netherlands. With a population density of approximately 508 people per square kilometer, the Netherlands had the highest population density among Western European countries in that year. This high population density can be attributed to its small land area combined with a relatively large population. The Netherlands has a total area of about 41,543 square kilometers and a population of around 17 million people. The country's efficient use of land, including the use of polders and other reclaimed land, has allowed it to accommodate a large population in a relatively small area."
Which country in Northern Africa had the lowest GDP in 2018?,"In 2018, the country in Northern Africa with the lowest GDP was Somalia. It's important to note that Somalia is not typically classified as part of Northern Africa by all geographers; it is often considered part of the Horn of Africa. However, if we consider the broader definition of Northern Africa that includes countries like Egypt, Libya, Tunisia, Algeria, and Morocco, then the country with the lowest GDP in that region in 2018 was likely to be Libya, due to the ongoing conflict and political instability affecting its economy."
Which country in Southern Europe had the lowest population density in 2019?,"In 2019, the country in Southern Europe with the lowest population density was Iceland. However, it is important to note that Iceland is not geographically located in Southern Europe; it is in the North Atlantic. If we strictly consider Southern European countries, then we can look at the following options: Portugal, Spain, Italy, Greece, and Malta.

Among these, Malta had the highest population density, while Spain had the lowest population density in 2019. Therefore, Spain had the lowest population density among the Southern European countries in 2019."
Which country in Western Europe had the lowest population density in 2015?,"In 2015, Iceland had the lowest population density among the countries in Western Europe. With a population of around 332,000 and an area of approximately 103,000 square kilometers, Iceland's population density was about 3.2 people per square kilometer. This low density is due to its rugged terrain, with vast areas covered by glaciers and volcanic landscapes, making large portions of the country unsuitable for agriculture or urban development."
Which country in Australasia had the lowest population in 2015?,"In 2015, the country in Australasia with the lowest population was Nauru. With an estimated population of around 10,084 people, Nauru is a small island nation in Micronesia, part of the region of Oceania. It is located in the Central Pacific and is one of the three independent republics in the Pacific Ocean. Despite its small size, Nauru has a rich history and culture, and is known for its phosphate mining industry, which has had a significant impact on the country's economy and environment."
Which country in Latin America and the Caribbean had the lowest population in 2020?,"According to the World Bank data, in 2020, the country in Latin America and the Caribbean with the lowest population was Saint Kitts and Nevis, with an estimated population of about 53,000 people."
Which country in Eastern Asia had the highest urban population in 2021?,"In 2021, China had the highest urban population in Eastern Asia. According to the United Nations Department of Economic and Social Affairs, the urban population of China was estimated to be over 1.01 billion people, accounting for approximately 60% of its total population. This significant urban population is a result of rapid urbanization and economic development in the country over the past few decades."
Which country in Micronesia had the lowest life expectancy in 2020?,"According to the World Bank data, in 2020, the country in Micronesia with the lowest life expectancy was the Federated States of Micronesia, with an average life expectancy of approximately 71.6 years. It's important to note that life expectancy can vary significantly within countries, and these figures are averages that may not represent the experience of all individuals or groups within the country."
Which country in Sub-Saharan Africa had the highest population density in 2013?,"In 2013, the country in Sub-Saharan Africa with the highest population density was Rwanda. With a population density of approximately 394 people per square kilometer, Rwanda was the most densely populated country in the region. This high population density can be attributed to its small land area and relatively large population, which is a result of high birth rates and a decrease in mortality rates due to improvements in healthcare."
Which country in Northern Europe had the lowest rural population in 2014?,"In 2014, Iceland had the lowest rural population among the countries in Northern Europe. With a total population of around 330,000, the majority of Iceland's inhabitants live in urban areas, particularly in the capital city, Reykjavik. The country's rural population is estimated to be around 20-25%, with the rest living in urban centers. This low rural population percentage is due to Iceland's challenging terrain, harsh climate, and limited arable land, which have historically led to a concentration of the population in urban areas where economic opportunities are more abundant."
Which country in Micronesia had the lowest rural population in 2014?,"According to the World Bank data, in 2014, the country in Micronesia with the lowest rural population was Nauru. Nauru is a small island nation in the Central Pacific, and it has a very small population overall, with the majority of its residents living in urban areas. The country's total population in 2014 was around 10,000, with less than 1% of the population living in rural areas."
Which country in Micronesia had the highest population in 2019?,"The Federated States of Micronesia had the highest population among the countries in Micronesia in 2019, with an estimated population of around 109,009 people."
Which country in Eastern Asia had the lowest energy consumption in 2013?,"In 2013, the country in Eastern Asia with the lowest energy consumption was North Korea. According to the BP Statistical Review of World Energy 2014, North Korea had an energy consumption of approximately 0.2 quadrillion British thermal units (BTUs), which is significantly lower than its neighboring countries. This low energy consumption can be attributed to the country's isolated economy, limited access to energy resources, and the government's focus on self-reliance in energy production."
Which country in Australasia had the lowest life expectancy in 2014?,"In 2014, Papua New Guinea had the lowest life expectancy in Australasia. The average life expectancy at birth was approximately 64 years, significantly lower than its neighboring countries due to various factors such as high rates of infectious diseases, poor healthcare infrastructure, and lower socioeconomic conditions."
Which country in Eastern Asia had the highest energy consumption in 2020?,"China had the highest energy consumption in Eastern Asia in 2020. As the world's most populous country and a major global economic power, China's energy demand has been growing rapidly. In 2020, China consumed approximately 10.2 billion tonnes of standard coal equivalent (tce) of primary energy, accounting for about 23% of global energy consumption. The country relies heavily on coal for its energy needs, but it is also investing heavily in renewable energy sources to reduce its carbon footprint and combat climate change."
