input,output
Which country will have the lower energy consumption in 2028: Ethiopia or Sri Lanka?,"As an AI, I cannot predict future events, but I can provide an analysis based on current trends and data. As of my last update in 2023, Ethiopia and Sri Lanka have different energy consumption profiles, with Ethiopia having a largely agrarian economy and a growing industrial sector, while Sri Lanka has a more diversified economy with a significant service sector.

Ethiopia has been investing heavily in renewable energy sources, particularly hydropower, and has plans to expand its energy infrastructure. The country's energy consumption has been growing due to its population growth and economic development. However, the government's focus on renewable energy could help moderate future energy consumption growth.

Sri Lanka, on the other hand, has been facing energy shortages and has been working to diversify its energy mix, including exploring renewable energy sources. The country's energy consumption has been growing due to its economic development and increasing urbanization.

Based on these factors, it is challenging to definitively say which country will have lower energy consumption in 2028. However, if both countries continue to invest in renewable energy and improve energy efficiency, it is possible that their energy consumption growth rates could slow down, leading to a more balanced energy consumption profile in the future."
Which country will have the higher urban population in 2030: Turkey or Uruguay?,"Based on current trends and projections from sources such as the United Nations Department of Economic and Social Affairs, Turkey is expected to have a higher urban population than Uruguay by 2030. As of my knowledge cutoff in 2023, Turkey's urban population is already significantly larger than Uruguay's, and this trend is projected to continue due to factors such as higher birth rates, rural-to-urban migration, and overall population growth in Turkey."
Which country will have the higher energy consumption in 2027: Papua New Guinea or Kenya?,"Predicting the exact energy consumption of specific countries like Papua New Guinea and Kenya for the year 2027 would require access to current and historical energy consumption data, as well as projections of economic growth, population growth, technological advancements, and energy policies. However, based on available data up to early 2023, I can provide a general analysis.

Kenya has a larger economy and population compared to Papua New Guinea, which suggests that its energy consumption is likely to be higher. Kenya's economy is more diversified and has been growing steadily, with significant investments in infrastructure, including energy. The country has been investing in renewable energy sources, such as geothermal and wind power, but it still relies heavily on oil and diesel for electricity generation.

Papua New Guinea, on the other hand, has a smaller economy and population. It is rich in natural resources, including oil, gas, and minerals, but its energy sector is less developed. The country faces challenges in expanding its energy infrastructure due to its rugged terrain and dispersed population.

Considering these factors, it is reasonable to predict that Kenya will have higher energy consumption than Papua New Guinea in 2027. However, this prediction is subject to change based on future developments in both countries' economies, energy policies, and technological advancements."
Which country will have the higher GDP in 2030: Liechtenstein or Tuvalu?,"Predicting the exact GDP of countries in 2030 is challenging due to the numerous variables involved, including economic policies, global market trends, and unforeseen events. However, based on current economic data and trends, Liechtenstein is likely to have a higher GDP in 2030 compared to Tuvalu.

Liechtenstein is a small, highly developed, and prosperous country with a strong financial sector, a high GDP per capita, and a stable political environment. It has a diversified economy with key sectors including finance, manufacturing, and services. Its strategic location between Switzerland and Austria also contributes to its economic success.

On the other hand, Tuvalu is a small island nation in the Pacific Ocean with a population of around 11,000 people. Its economy is primarily based on subsistence agriculture, fishing, and remittances from Tuvaluans working abroad. Tuvalu faces significant challenges such as limited natural resources, vulnerability to climate change, and a small domestic market.

While it is difficult to predict the exact GDP figures for 2030, Liechtenstein's strong economic fundamentals and Tuvalu's challenges suggest that Liechtenstein will likely have a higher GDP in 2030."
Which country will have the lower population in 2030: Portugal or Italy?,"Predicting future population trends involves analyzing current demographic data, trends, and projections. According to the United Nations World Population Prospects 2019, Italy is projected to have a lower population in 2030 compared to Portugal. As of 2021, Italy's population is around 60 million, while Portugal's is about 10 million. The UN projects that by 2030, Italy's population will decrease to around 58 million, while Portugal's will increase to approximately 10.5 million. Therefore, based on these projections, Italy will have the lower population in 2030.

However, it's important to note that these are projections and actual future populations may vary due to factors such as changes in birth rates, death rates, immigration, and government policies."
Which country will have the higher population in 2030: Bosnia and Herzegovina or Switzerland?,"Predicting the exact population of a country in 2030 requires access to current demographic data and trends, which I don't have. However, based on the latest available data and trends, Switzerland is expected to have a higher population in 2030 compared to Bosnia and Herzegovina. As of 2021, Switzerland's population is around 8.6 million, while Bosnia and Herzegovina's population is around 3.3 million. Both countries have relatively low birth rates, but Switzerland has a higher immigration rate, which contributes to its population growth. However, these projections can change due to various factors such as changes in immigration policies, birth rates, and mortality rates."
Which country will have the higher life expectancy in 2027: Ireland or Samoa?,"Predicting the exact life expectancy for a specific year like 2027 for individual countries can be challenging without access to current and projected health data, trends, and potential future events that could impact public health. However, based on the latest available data up to early 2023, Ireland generally has a higher life expectancy compared to Samoa.

Ireland has consistently ranked high in global life expectancy rankings, benefiting from a strong healthcare system, high standard of living, and a relatively low rate of lifestyle-related diseases. According to the World Bank and the World Health Organization, as of the latest data, the life expectancy in Ireland was around 82 years.

Samoa, while having made significant improvements in healthcare and life expectancy over the past decades, still has a lower life expectancy compared to Ireland. The latest data suggests that life expectancy in Samoa is around 75 years.

Given the current trends and without significant unforeseen changes, it is reasonable to predict that Ireland will likely maintain a higher life expectancy than Samoa in 2027. However, it is important to note that these predictions are subject to change based on various factors, including advancements in healthcare, changes in lifestyle, and potential global health crises."
Which country will have the lower life expectancy in 2027: Ethiopia or Japan?,"Predicting the exact life expectancy for specific countries in 2027 would require access to current and projected health, economic, and social data, which is beyond my last update in early 2023. However, based on historical trends and current data up to that point, Japan has consistently had one of the highest life expectancies in the world, while Ethiopia has had a lower life expectancy compared to Japan. Factors such as healthcare quality, economic development, nutrition, and public health policies significantly influence life expectancy.

As of my last update, Japan's life expectancy was among the highest globally, while Ethiopia's was lower, reflecting disparities in healthcare systems, economic conditions, and other social determinants of health. Unless there are significant changes in these factors, it is reasonable to expect that Japan will continue to have a higher life expectancy than Ethiopia in 2027. However, for the most accurate and up-to-date predictions, it is recommended to consult the latest reports from sources such as the World Health Organization (WHO) or the United Nations (UN) projections."
Which country will have the lower rural population in 2027: Syria or Qatar?,"Based on current trends and projections, Qatar is expected to have a lower rural population in 2027 compared to Syria. Qatar's population is predominantly urban, with a significant portion living in the capital city of Doha, which is a major urban center. In contrast, Syria has experienced significant rural-to-urban migration, but due to the ongoing conflict and displacement, the rural population has been affected differently. However, considering the urbanization trends and the impact of the conflict, Qatar is likely to maintain a lower rural population in 2027."
Which country will have the lower population density in 2030: Vietnam or Tajikistan?,"Predicting the exact population density of countries in 2030 involves a number of variables, including current population trends, birth rates, death rates, immigration, and government policies. However, based on current trends and projections, it is possible to make an educated guess.

As of my knowledge cutoff in 2023, Vietnam has a population of approximately 97 million people and an area of about 331,210 square kilometers, resulting in a population density of roughly 293 people per square kilometer. Tajikistan, on the other hand, has a population of around 9.6 million people and an area of about 143,100 square kilometers, resulting in a population density of approximately 67 people per square kilometer.

Given these figures and assuming that current trends continue, it is likely that Vietnam will maintain a higher population density than Tajikistan in 2030. However, this is a projection and actual future population densities will depend on a variety of factors."
Which country will have the higher birth rate in 2026: Sao Tome and Principe or Kiribati?,"As an AI, I don't have the ability to predict future events or data. However, I can provide you with the most recent data available up to my last update in September 2021. According to the World Bank data from 2018, Sao Tome and Principe had a birth rate of 21.7 births per 1,000 population, while Kiribati had a birth rate of 27.9 births per 1,000 population.

To determine which country will have a higher birth rate in 2026, you would need to consider factors such as changes in fertility rates, government policies, healthcare improvements, and socioeconomic conditions. It's also important to consult the latest projections from reliable sources, such as the United Nations Department of Economic and Social Affairs (UN DESA) or the World Bank.

Please note that these projections are estimates and actual future birth rates may vary."
Which country will have the higher population density in 2030: Dominica or Namibia?,"Predicting the exact population density of countries in 2030 requires access to current demographic trends, growth rates, and potential changes in land area. However, based on available data up to early 2023, we can make an educated guess.

As of the latest data, Dominica has a population of around 72,000 people and an area of about 751 square kilometers, resulting in a population density of approximately 95 people per square kilometer. Namibia, on the other hand, has a population of around 2.5 million people and an area of about 825,000 square kilometers, resulting in a population density of around 3 people per square kilometer.

Given these figures and assuming that both countries' populations grow at their current rates without significant changes in land area, Dominica is likely to maintain a much higher population density than Namibia in 2030. However, it's important to note that these predictions can be influenced by various factors, including migration, birth rates, and government policies."
Which country will have the lower population in 2029: Comoros or the Pitcairn Islands?,"Based on current population trends and projections, the Pitcairn Islands will have a lower population in 2029 compared to Comoros. The Pitcairn Islands, a small British Overseas Territory in the Pacific Ocean, had a population of around 50-60 people as of 2021. In contrast, Comoros, an island nation in the Indian Ocean, had a population of over 850,000 in 2021. Given the significantly smaller population size and limited growth potential of the Pitcairn Islands, it is highly likely that they will maintain a lower population than Comoros in 2029."
Which country will have the lower rural population in 2026: Suriname or Belize?,"To answer this question accurately, I would need the most recent population projections for both Suriname and Belize. However, as of my last update in early 2023, I can provide you with the latest available data and trends to help you make an informed guess.

As of 2023, Suriname has a population of approximately 600,000 people, with around 50% living in rural areas. Belize, on the other hand, has a population of around 400,000 people, with about 30% living in rural areas.

If we assume that both countries continue to urbanize at their current rates, it is likely that Belize will have a lower rural population in 2026 compared to Suriname. This is because Belize has a lower overall population and a smaller proportion of its population living in rural areas, which suggests a higher rate of urbanization.

However, please note that these are only estimates based on the latest available data, and actual future population trends can be influenced by various factors such as migration, birth rates, and government policies."
Which country will have the lower population density in 2028: Ghana or Montserrat?,"To accurately predict which country will have the lower population density in 2028 between Ghana and Montserrat, we would need to consider current population trends, growth rates, and any significant factors that might influence these rates in the future. As of my last update in 2023, Montserrat, a small island in the Caribbean, has a significantly lower population density compared to Ghana, a country in West Africa.

Montserrat had a population of around 5,000 people in 2021, with a land area of about 102 square kilometers, leading to a very low population density. Ghana, on the other hand, had a population of over 30 million in 2021, with a land area of approximately 238,537 square kilometers, resulting in a higher population density.

Given that both countries have different population growth rates, with Ghana experiencing a higher growth rate than Montserrat, it is likely that Ghana will continue to have a higher population density in 2028. However, without specific projections for 2028, this is a general assumption based on current trends. Population density can be influenced by various factors, including migration, birth rates, death rates, and government policies, which could alter these projections.

In summary, based on the available data and trends up to 2023, it is reasonable to predict that Montserrat will likely have a lower population density than Ghana in 2028, assuming no drastic changes in population growth rates or significant demographic shifts occur in either country."
Which country will have the higher population in 2029: the Falkland Islands or Madagascar?,"Madagascar will have a significantly higher population in 2029 compared to the Falkland Islands. As of my last update in 2023, Madagascar's population is over 26 million people, while the Falkland Islands have a population of around 3,400. Given the current growth rates and lack of significant population growth in the Falkland Islands, Madagascar is expected to maintain a much larger population in 2029."
Which country will have the lower energy consumption in 2026: Martinique or Oman?,"To accurately answer which country will have the lower energy consumption in 2026 between Martinique and Oman, one would need to consult the latest energy consumption forecasts and reports from reliable sources such as the International Energy Agency (IEA), the U.S. Energy Information Administration (EIA), or other authoritative energy data providers. These organizations often publish projections based on various factors including economic growth, energy policies, technological advancements, and historical consumption trends.

As of my last update in early 2023, I don't have access to real-time data or the ability to predict future events. However, I can provide some context based on historical data and trends up to that point.

Martinique is a small island region of France located in the Caribbean. Its energy consumption is relatively low compared to larger countries, and it relies heavily on imported fossil fuels for electricity generation, although there has been a push towards renewable energy sources. Martinique's energy consumption is also influenced by its tourism industry and small industrial sector.

Oman, on the other hand, is a country on the southeastern coast of the Arabian Peninsula in Western Asia. It is an OPEC member and has significant oil and natural gas reserves. Oman's economy is heavily dependent on the energy sector, and its energy consumption is closely tied to its production levels. However, Oman has been working on diversifying its economy and investing in renewable energy sources.

Given these general trends, it is challenging to predict with certainty which country will have lower energy consumption in 2026 without the latest data. However, based on the size and economic structure of Martinique compared to Oman, it is plausible that Martinique could have lower energy consumption in 2026, assuming no significant changes in economic activity or energy policies."
Which country will have the lower rural population in 2026: Bangladesh or Slovenia?,"To accurately answer which country will have the lower rural population in 2026 between Bangladesh and Slovenia, we would need to look at the most recent projections or trends in rural population changes for both countries. However, as of my last update in 2023, I can provide some context based on available data up to that point.

Bangladesh is a densely populated country with a significant portion of its population living in rural areas, although urbanization has been increasing. As of the latest data, a large percentage of Bangladesh's population still resides in rural areas, but the country is experiencing rapid urbanization.

Slovenia, on the other hand, is a much smaller country with a lower overall population. It has a higher level of urbanization compared to Bangladesh, with a smaller proportion of its population living in rural areas.

Based on these trends, it is likely that Slovenia will have a lower rural population than Bangladesh in 2026. However, for the most current and accurate projections, it would be best to consult the latest data from sources such as the United Nations Department of Economic and Social Affairs, World Bank, or the respective national statistical offices of Bangladesh and Slovenia."
Which country will have the lower birth rate in 2029: the Netherlands or France?,"Predicting the exact birth rate of a country for a specific year like 2029 is challenging without current trends and policies in mind. However, as of my last update in early 2023, the Netherlands has a lower birth rate compared to France. France has historically had a higher birth rate and has implemented various family-friendly policies to encourage childbirth, such as generous parental leave, family allowances, and subsidized childcare. The Netherlands also has supportive policies but has a more pronounced aging population and lower fertility rates.

If current trends continue, it's plausible that France may maintain a higher birth rate than the Netherlands in 2029. However, this is a projection and actual future rates could be influenced by changes in policies, economic conditions, and societal trends."
Which country will have the lower GDP in 2028: Luxembourg or Hong Kong?,"As an AI, I cannot predict the future, but I can provide an analysis based on current trends and data. As of my last update in 2023, Luxembourg and Hong Kong both have strong economies, but they operate in different contexts. Luxembourg is a small, landlocked country in Europe with a high GDP per capita due to its status as a global financial center. Hong Kong is a Special Administrative Region of China, known for its significant financial services sector and as a global financial hub.

To determine which country might have a lower GDP in 2028, we would need to consider various factors such as economic growth rates, political stability, global economic conditions, and potential changes in their respective industries.

However, without the ability to predict future events, it is not possible to definitively say which country will have a lower GDP in 2028."
Which country will have the higher birth rate in 2030: Ukraine or Jamaica?,"Predicting the exact birth rate of a country for a specific year like 2030 involves numerous variables and uncertainties. However, based on current trends and data, we can make an educated guess. As of my last update in 2023, Jamaica has had a higher birth rate compared to Ukraine in recent years. However, both countries have been experiencing declining birth rates, a trend common in many parts of the world due to factors such as increased access to education, improved women's rights, and economic considerations.

Jamaica's birth rate has been gradually decreasing but remains higher than Ukraine's. According to the World Bank and the United Nations data, Jamaica's birth rate was around 16.9 births per 1,000 population in 2020, while Ukraine's was about 9.8 births per 1,000 population in the same year.

If current trends continue, it's plausible that Jamaica might still have a higher birth rate than Ukraine in 2030. However, this is a projection and actual future rates could be influenced by changes in government policies, economic conditions, healthcare access, and societal shifts in both countries."
Which country will have the higher population density in 2029: Guam or Gambia?,"Predicting the exact population density of Guam and Gambia in 2029 would require access to current demographic trends, birth rates, death rates, immigration, and emigration figures, as well as potential policy changes that could affect these numbers. However, based on available data up to early 2023, Gambia has a higher population density than Guam.

As of 2023, Gambia has a population density of around 400 people per square kilometer, one of the highest in the world, due to its small land area and relatively large population. Guam, a U.S. territory in the Western Pacific, has a much lower population density, with around 170 people per square kilometer.

If current trends continue, it is likely that Gambia will maintain a higher population density than Guam in 2029. However, this is a projection and actual future population densities could be influenced by a variety of factors."
Which country will have the higher rural population in 2026: Antigua and Barbuda or Morocco?,"To determine which country will have a higher rural population in 2026 between Antigua and Barbuda and Morocco, we would need to look at the most recent population projections or trends for both countries. However, as of my last update in early 2023, I don't have access to real-time data or projections beyond that point.

As a general observation, Morocco has a significantly larger population than Antigua and Barbuda, and it is also a country with a substantial rural population. Morocco's rural population has been gradually decreasing as urbanization increases, but it still remains a large portion of the country's total population.

Antigua and Barbuda, on the other hand, is a much smaller nation with a smaller overall population, and its rural population is also smaller in absolute numbers compared to Morocco.

Based on these general trends and without specific projections for 2026, it is likely that Morocco will have a higher rural population than Antigua and Barbuda in 2026. However, for the most accurate and up-to-date information, I recommend consulting the latest population projections from a reliable source such as the United Nations Department of Economic and Social Affairs or the respective national statistical offices."
