input,output
What will be Dominica's energy consumption in 2029?,"As an AI, I don't have the ability to predict future events or access real-time data. To estimate Dominica's energy consumption in 2029, I would need to analyze historical data, current trends, and any known future plans or policies that could affect energy consumption. However, without access to up-to-date databases or models, I cannot provide an accurate prediction."
What will be Romania's population in 2030?,"Predicting the exact population of Romania in 2030 involves several factors, including current population trends, birth rates, death rates, immigration, and government policies. According to the World Bank, Romania's population was approximately 19.41 million in 2021. The country has been experiencing a declining population trend due to low birth rates and emigration.

The United Nations Department of Economic and Social Affairs (UN DESA) provides population projections. According to the UN's 2019 World Population Prospects, Romania's population is projected to decrease to about 18.4 million by 2030.

Please note that these projections are based on current trends and assumptions, and actual future population numbers may vary due to unforeseen events or changes in demographic patterns."
What will be Åland Islands's birth rate in 2030?,"I'm an AI language model and cannot predict future events or data. To estimate the Åland Islands' birth rate in 2030, one would need to analyze current demographic trends, fertility rates, and other relevant factors. However, I can guide you on how to approach this estimation.

1. Obtain the most recent birth rate data for the Åland Islands.
2. Examine historical trends in the birth rate over the past few decades.
3. Consider factors that may influence future birth rates, such as changes in government policies, economic conditions, and social trends.
4. Use demographic models or statistical methods to project the birth rate into the future, taking into account the factors mentioned above.

For the most accurate and up-to-date information, I recommend consulting the latest reports and projections from the Åland Islands' statistical office or other reputable sources."
What will be Mauritania's urban population in 2028?,"I cannot predict future events or data, including Mauritania's urban population in 2028. However, I can guide you on how to estimate it based on available data and growth trends.

To estimate Mauritania's urban population in 2028, you can follow these steps:

1. Find the most recent data on Mauritania's urban population. According to the World Bank, the urban population of Mauritania was approximately 1.6 million in 2020.

2. Determine the annual growth rate of Mauritania's urban population. According to the World Bank, the annual urban population growth rate in Mauritania was about 3.4% in 2020.

3. Use the compound annual growth rate (CAGR) formula to estimate the urban population in 2028:

   Future Population = Present Population * (1 + Growth Rate) ^ Number of Years

   Future Population = 1,600,000 * (1 + 0.034) ^ 8

4. Calculate the future population:

   Future Population ≈ 1,600,000 * (1.034) ^ 8
   Future Population ≈ 1,600,000 * 1.316
   Future Population ≈ 2,105,600

Based on the available data and assuming a constant growth rate, Mauritania's urban population could be around 2,105,600 in 2028. However, keep in mind that this is just an estimate and actual future population numbers may vary due to various factors such as changes in birth rates, death rates, migration patterns, and government policies."
What will be Ireland's population in 2029?,"As an AI, I cannot predict the future, but I can provide an estimate based on current trends and data. According to the World Bank, Ireland's population was approximately 4.93 million in 2021. The United Nations projects that Ireland's population will reach around 5.39 million by 2029, growing at an average annual rate of about 0.7%. However, these projections are subject to change due to various factors such as birth rates, death rates, and migration patterns."
What will be Botswana's population density in 2029?,"I cannot predict the future, but I can provide an estimate based on available data and trends. As of my last update in September 2021, Botswana's population was approximately 2.38 million people, with an area of about 581,730 square kilometers. The population density was roughly 4.1 people per square kilometer.

To estimate the population density in 2029, we can use the average annual population growth rate. According to the World Bank, Botswana's population growth rate was about 1.9% in 2020. If we assume this growth rate remains constant, we can estimate the population in 2029 using the formula:

Future Population = Present Population * (1 + Growth Rate)^(Number of Years)

Future Population in 2029 = 2,380,000 * (1 + 0.019)^(2029-2021)
Future Population in 2029 ≈ 2,380,000 * (1.019)^8
Future Population in 2029 ≈ 2,380,000 * 1.171
Future Population in 2029 ≈ 2,787,780

Now, let's calculate the estimated population density in 2029:

Population Density = Population / Area
Population Density in 2029 = 2,787,780 / 581,730
Population Density in 2029 ≈ 4.8 people per square kilometer

So, based on the assumptions made, Botswana's population density in 2029 could be around 4.8 people per square kilometer. However, please note that this is a rough estimate and actual future population density may vary depending on various factors such as changes in birth rates, death rates, and migration patterns."
What will be Saint Kitts and Nevis's birth rate in 2029?,"I'm sorry, but as an AI developed by Microsoft, I don't have the ability to predict future statistics such as the birth rate for Saint Kitts and Nevis in 2029. Birth rates are influenced by a wide range of factors including economic conditions, access to healthcare and family planning, cultural trends, and government policies, which can change over time.

To estimate the birth rate for Saint Kitts and Nevis in 2029, one would typically look at historical birth rate trends and consider any known factors that might influence future rates. This could involve analyzing data from sources such as the World Bank, the United Nations, or the government of Saint Kitts and Nevis itself.

For the most accurate and up-to-date information, I recommend checking the latest reports and projections from reputable demographic research institutions or the national statistics office of Saint Kitts and Nevis."
What will be Saint Kitts and Nevis's rural population in 2029?,"I'm sorry, but as an AI developed by Microsoft, I don't have the ability to predict future events or access real-time data. To estimate the rural population of Saint Kitts and Nevis in 2029, you would need to look at current demographic trends, birth rates, death rates, and migration patterns, and possibly consult projections made by organizations such as the United Nations or the World Bank."
What will be Tajikistan's life expectancy in 2028?,"I cannot predict the future, but I can provide an estimate based on available data and trends. As of my last update in early 2023, the life expectancy in Tajikistan was around 72 years according to the World Bank. To estimate the life expectancy in 2028, we can look at the historical trends and the current health initiatives in the country.

Tajikistan has been working on improving its healthcare system, and there have been efforts to combat diseases such as tuberculosis and HIV/AIDS. However, challenges such as poverty, limited access to healthcare in rural areas, and the impact of the COVID-19 pandemic could affect life expectancy.

Based on the available data and trends, it is reasonable to expect a slight increase in life expectancy in Tajikistan by 2028, possibly reaching around 73-74 years. However, this is just an estimate, and the actual life expectancy in 2028 will depend on various factors, including the country's healthcare policies, economic development, and global health trends."
What will be Austria's GDP in 2030?,"I cannot predict the future, but I can provide an estimate based on available data and trends. According to the International Monetary Fund (IMF), Austria's Gross Domestic Product (GDP) is projected to reach approximately $500 billion by 2030. However, this projection is subject to change based on various economic factors and global events."
What will be Morocco's urban population in 2026?,"To estimate Morocco's urban population in 2026, we would need to know the current urban population, the annual growth rate, and any significant factors that might affect urbanization trends. However, I can provide an estimate based on available data and projections.

According to the World Bank, Morocco's urban population was approximately 53.7% of its total population in 2020. Morocco's total population was around 36.8 million in 2020. Assuming a steady urbanization rate and population growth, we can estimate the urban population in 2026.

The United Nations Department of Economic and Social Affairs (UN DESA) projects that Morocco's population will reach about 40.6 million by 2026, with an urbanization rate of around 58.5% by that year.

Using these projections, we can estimate Morocco's urban population in 2026 as follows:

Urban population in 2026 = Total population in 2026 * Urbanization rate in 2026
Urban population in 2026 = 40.6 million * 0.585
Urban population in 2026 ≈ 23.6 million

So, based on available projections, Morocco's urban population in 2026 is estimated to be around 23.6 million people. However, please note that this is an estimate and actual figures may vary due to various factors."
What will be Eritrea's population in 2026?,"I cannot predict future events or data, including population figures. However, I can provide you with an estimate based on available data and growth rates.

According to the World Bank, Eritrea's population was approximately 3.5 million in 2020. The country's population growth rate was estimated at about 2.4% per year as of 2021.

To estimate the population in 2026, we can use the formula for exponential growth:

P(t) = P0 * (1 + r)^t

Where:
P(t) = future population
P0 = initial population (3.5 million)
r = growth rate (2.4% or 0.024)
t = time in years (2026 - 2020 = 6)

P(6) = 3,500,000 * (1 + 0.024)^6
P(6) ≈ 3,500,000 * 1.159274
P(6) ≈ 4,055,339

Based on this calculation, Eritrea's population could be around 4,055,339 in 2026. However, keep in mind that this is just an estimate and actual population figures may vary due to various factors such as changes in birth rates, death rates, and migration patterns."
What will be Bhutan's energy consumption in 2029?,"As an AI, I don't have the ability to predict future events or data. However, I can help you understand how to estimate Bhutan's energy consumption in 2029 based on available data and trends.

To estimate Bhutan's energy consumption in 2029, you would need to consider several factors, including historical energy consumption data, population growth, economic development, and government energy policies. Bhutan's energy sector is unique because the country is a net exporter of electricity, primarily generated from hydroelectric power.

Here's a step-by-step approach to estimate Bhutan's energy consumption in 2029:

1. Gather historical energy consumption data: Collect data on Bhutan's energy consumption from reliable sources such as the Bhutan Power Corporation, the Ministry of Economic Affairs, or international organizations like the International Energy Agency (IEA) or the World Bank.

2. Analyze population growth: Estimate Bhutan's population growth rate from 2021 to 2029 using historical data and projections from sources like the United Nations or the National Statistical Bureau of Bhutan.

3. Consider economic development: Examine Bhutan's Gross Domestic Product (GDP) growth rate and other economic indicators to understand how economic development may impact energy consumption.

4. Assess government energy policies: Review Bhutan's energy policies and plans, such as the 12th Five-Year Plan (2021-2026) and the National Energy Policy, to understand the government's goals and strategies for energy development and consumption.

5. Estimate energy consumption per capita: Calculate the average energy consumption per capita based on historical data and adjust it for population growth and economic development.

6. Account for energy exports: Since Bhutan is a net exporter of electricity, consider the impact of energy exports on domestic energy consumption. You may need to estimate the proportion of energy generated for export and adjust domestic energy consumption accordingly.

7. Make projections: Using the information gathered and analyzed in the previous steps, make projections for Bhutan's energy consumption in 2029. You can use statistical methods like time series analysis or regression models to create a forecast.

Remember that this is just an estimation, and actual energy consumption in 2029 may vary due to unforeseen factors such as changes in government policies, technological advancements, or global economic conditions."
What will be Macao's population in 2029?,"I cannot predict future events or data, including population figures. However, I can guide you on how to estimate it based on current trends.

To estimate Macao's population in 2029, you would need the most recent population data and growth rates. You can then apply the average annual growth rate to project the population in 2029.

Here's a step-by-step method to estimate the population:

1. Find the most recent population data for Macao. As of my last update in 2023, Macao's population was approximately 680,000.

2. Determine the average annual population growth rate. This can be found in demographic studies or statistical reports from reliable sources like the Statistics and Census Service of Macao.

3. Use the formula for exponential growth: P = P0 * (1 + r)^t, where:
   - P is the future population
   - P0 is the current population (680,000)
   - r is the annual growth rate (as a decimal)
   - t is the number of years (2029 - current year)

4. Calculate the future population using the formula.

Remember, this is just an estimate and actual future population can be influenced by various factors such as migration, birth rates, and government policies."
What will be Guernsey's urban population in 2029?,"I cannot predict future events or data, including Guernsey's urban population in 2029."
What will be Tonga's energy consumption in 2026?,"As an AI, I don't have real-time data access or the ability to predict future events. To estimate Tonga's energy consumption in 2026, one would need to analyze historical energy consumption data, consider current energy policies, economic growth projections, population trends, and potential changes in energy technology and infrastructure. If you have access to relevant data, I can help you create a model to estimate future energy consumption."
What will be Luxembourg's energy consumption in 2028?,"As an AI, I don't have the ability to predict future events or data, but I can help you understand how you might estimate Luxembourg's energy consumption in 2028 based on available data and trends.

To estimate Luxembourg's energy consumption in 2028, you would need to consider several factors, including historical energy consumption data, population growth, economic development, energy policies, and technological advancements. Here's a step-by-step approach to making an educated estimate:

1. Gather historical energy consumption data: Obtain Luxembourg's energy consumption data from reliable sources such as the International Energy Agency (IEA) or Luxembourg's national energy agency. Analyze the data to identify trends and patterns in energy consumption over the past few decades.

2. Consider population growth: Luxembourg's population has been steadily increasing. According to the World Bank, Luxembourg's population was around 634,000 in 2020. Project the population growth rate to estimate the population in 2028.

3. Analyze economic development: Luxembourg has a highly developed and diversified economy, with a strong focus on financial services, manufacturing, and information and communication technologies. Consider the country's GDP growth rate and economic projections to estimate future energy demand.

4. Assess energy policies and targets: Luxembourg has set ambitious energy and climate targets, aiming to reduce greenhouse gas emissions by 55% by 2030 and achieve climate neutrality by 2050. Review the country's energy policies and targets to understand how they might impact future energy consumption.

5. Account for technological advancements: Technological advancements in energy efficiency, renewable energy, and energy storage can significantly impact energy consumption. Consider the potential impact of these advancements on Luxembourg's energy consumption in 2028.

6. Use forecasting models: Based on the information gathered, use energy forecasting models to estimate Luxembourg's energy consumption in 2028. These models can incorporate historical data, population and economic projections, energy policies, and technological advancements to provide an estimate of future energy consumption.

Remember that this estimate will be an approximation, as it is challenging to predict future events and data accurately. However, by considering the factors mentioned above, you can make an informed estimate of Luxembourg's energy consumption in 2028."
What will be Kazakhstan's birth rate in 2026?,"As an AI, I cannot predict future events or data with certainty. However, I can provide an estimate based on current trends and available data. According to the United Nations World Population Prospects 2019, Kazakhstan's total fertility rate (TFR) was estimated at 1.83 children per woman in 2019. The TFR is a measure of the number of children a woman would have over her lifetime based on current age-specific fertility rates.

To estimate the TFR for 2026, we can look at the historical trends and the United Nations' medium-variant projection, which assumes that current trends will continue without major changes. According to the UN's 2019 revision, the medium-variant projection for Kazakhstan's TFR in 2026 is 1.76 children per woman.

Please note that this is just an estimate based on current trends and assumptions, and the actual TFR in 2026 could be influenced by various factors such as changes in government policies, economic conditions, and social norms."
What will be French Polynesia's birth rate in 2027?,"I'm sorry, but as an AI developed by Microsoft, I don't have the ability to predict future events or data, including specific demographic statistics like the birth rate for French Polynesia in 2027. To obtain this information, you would need to consult the latest demographic research or projections from a reliable source such as the United Nations Department of Economic and Social Affairs or the Institut de la Statistique et de la Démographie de Polynésie Française."
What will be Cameroon's life expectancy in 2027?,"I cannot predict the future, but I can provide information based on current trends and data. As of my last update in 2023, the life expectancy in Cameroon was around 63.9 years according to the World Bank. However, this figure can change due to various factors such as healthcare improvements, economic conditions, and public health initiatives."
What will be Germany's GDP in 2027?,I cannot predict future economic data such as Germany's GDP in 2027 as it requires up-to-date economic analysis and forecasting models.
What will be Haiti's urban population in 2026?,"To estimate Haiti's urban population in 2026, we would need to know the current urban population, the annual growth rate, and any other relevant demographic factors. However, without specific data, I can provide a hypothetical projection based on assumptions.

According to the World Bank, Haiti's urban population was approximately 3.3 million in 2020, which was about 54% of its total population. Assuming a steady urban growth rate, we can estimate the urban population in 2026.

Let's assume an annual urban growth rate of 2.5%, which is a rough estimate based on historical trends. Using the compound annual growth rate (CAGR) formula:

Future Population = Present Population * (1 + Growth Rate) ^ Number of Years

Future Urban Population in 2026 = 3,300,000 * (1 + 0.025) ^ (2026 - 2020)
Future Urban Population in 2026 = 3,300,000 * (1.025) ^ 6
Future Urban Population in 2026 ≈ 3,300,000 * 1.159274
Future Urban Population in 2026 ≈ 3,822,000

Based on this hypothetical scenario with a 2.5% annual growth rate, Haiti's urban population could be around 3.82 million in 2026. However, please note that this is a simplified projection and actual future population figures may vary due to a range of factors including economic conditions, migration patterns, government policies, and significant events."
What will be Taiwan's urban population in 2026?,"I cannot predict future events or data, including Taiwan's urban population in 2026. To obtain the most accurate and up-to-date information, please refer to the latest demographic studies or projections from reputable sources such as the United Nations or Taiwan's Department of Statistics."
What will be Georgia's urban population in 2030?,"To provide an accurate prediction for Georgia's urban population in 2030, I would need the current urban population data and the annual growth rate. However, as an AI, I don't have real-time data access. According to the United Nations World Urbanization Prospects 2018, the urban population of Georgia (country) was estimated to be around 3.7 million in 2018. If we assume a steady growth rate, we can estimate the urban population in 2030 using the formula:

Future Population = Present Population * (1 + Growth Rate) ^ Number of Years

Assuming a hypothetical annual urban growth rate of 1.2% (which is an example and may not reflect the actual growth rate), the calculation would be:

Future Population in 2030 = 3,700,000 * (1 + 0.012) ^ (2030-2018)
Future Population in 2030 = 3,700,000 * (1.012) ^ 12
Future Population in 2030 ≈ 4,255,000

So, with a 1.2% annual growth rate, Georgia's urban population in 2030 would be approximately 4.26 million. However, please note that this is a hypothetical scenario, and the actual population will depend on the actual growth rate and other demographic factors."
What will be Haiti's life expectancy in 2028?,"I cannot predict the future, but I can provide information based on current trends and data. As of my last update in 2023, Haiti's life expectancy was around 66 years according to the World Bank. However, to estimate the life expectancy for 2028, one would need to consider various factors such as healthcare improvements, economic conditions, political stability, and public health initiatives. It's important to consult the latest data and projections from reliable sources like the World Health Organization or the World Bank for the most accurate and up-to-date information."
What will be Réunion's population in 2028?,"To estimate Réunion's population in 2028, we would need to know the current population and the average annual growth rate. According to the World Bank, Réunion's population was approximately 861,635 in 2021. The annual growth rate was about 0.8% in 2021.

Using the formula for exponential growth:

P(t) = P0 * e^(rt)

Where:
P(t) = future population
P0 = current population (861,635)
r = annual growth rate (0.8% or 0.008)
t = time in years (2028 - 2021 = 7)

P(7) = 861,635 * e^(0.008 * 7)

P(7) ≈ 861,635 * e^(0.056)

P(7) ≈ 861,635 * 1.057

P(7) ≈ 909,000

So, the estimated population of Réunion in 2028 would be around 909,000 people. However, this is just an estimate and actual population numbers can vary due to various factors such as migration, birth rates, and death rates."
What will be Tokelau's population density in 2026?,"I cannot predict the future, but I can provide an estimate based on available data and trends. As of my last update in September 2021, Tokelau had a population of around 1,499 people and a total land area of about 10 square kilometers.

To estimate the population density in 2026, we can use the average annual growth rate. According to the World Bank, Tokelau's population growth rate was approximately 0.3% per year from 2015 to 2020. If we assume this growth rate remains constant, we can estimate the population in 2026 as follows:

Population in 2026 = 1,499 * (1 + 0.003)^(2026-2021)
Population in 2026 ≈ 1,549

Now, we can calculate the population density in 2026 using the estimated population and the total land area:

Population density in 2026 = Population in 2026 / Land area
Population density in 2026 ≈ 1,549 / 10
Population density in 2026 ≈ 154.9 people per square kilometer

So, based on the available data and assuming a constant growth rate, Tokelau's population density in 2026 could be around 154.9 people per square kilometer. However, please note that this is just an estimate and actual figures may vary depending on various factors such as migration, birth rates, and government policies."
